{"attestations":[{"attested":true,"attested_at_utc":"2026-07-26T16:02:44Z","attested_by":"codex-validation-capture","kind":"derived-only","statement":"The request contains only derived identifiers, hashes, counts, locators, and explicit gaps."},{"attested":true,"attested_at_utc":"2026-07-26T16:02:44Z","attested_by":"codex-validation-capture","kind":"no-taxpayer-values","statement":"No real taxpayer values were used or copied during this capture."},{"attested":true,"attested_at_utc":"2026-07-26T16:02:44Z","attested_by":"codex-validation-capture","kind":"no-credentials","statement":"No credentials were used or copied during this capture."},{"attested":true,"attested_at_utc":"2026-07-26T16:02:44Z","attested_by":"codex-validation-capture","kind":"no-online-submission","statement":"No online submission path was used during this capture."}],"canonicalization":"bir-json-c14n-v1","capture_provenance":{"capture_tool_version":"bir-rules-codegen 0.1.0 @ 13c7ee93d46f9b2e70ee24e8d4a2a1acd76fd419","command_argv":["bir-rules-codegen","verify-evidence-vault-source-map","--source-map","../validation-rules-evidence-input/maps/validation-rules-source-map-v1.json"],"finished_at_utc":"2026-07-26T15:54:37Z","official_app_version":"7.9.6.0","operating_system":"windows","started_at_utc":"2026-07-26T15:53:49Z","tool_commit":"13c7ee93d46f9b2e70ee24e8d4a2a1acd76fd419","windows_version":"Microsoft Windows [Version 10.0.26200.8875]"},"created_at_utc":"2026-07-26T16:02:44Z","derived_evidence":[{"classification":"non-taxpayer-derived","kind":"gap-report","media_type":"application/json","observation":{"reason":"The reviewed capture ledger records explicit evidence gaps; see the value-free gap inventory.","status":"gap"},"path":"derived/gaps.json","review_status":"reviewed","sha256":"a19872ecc311ed0643981f7d7c1c8a67327f32f1f2346d544e22b95ff9902fd1","size_bytes":848,"source_evidence_ids":["sha256-de8ef0815509d65189e6794e1f8135a5ecf5f2800005d1fc5c87043efd96dbca"],"source_excerpt":null},{"classification":"non-taxpayer-derived","kind":"record-census","media_type":"application/json","observation":{"status":"observed"},"path":"derived/tracked-v1-summary.json","review_status":"reviewed","sha256":"d52c8b2f127522d8ee65783ef3c53de014169ed4d95efd66028afd21ba54bfd3","size_bytes":130447,"source_evidence_ids":["sha256-de8ef0815509d65189e6794e1f8135a5ecf5f2800005d1fc5c87043efd96dbca"],"source_excerpt":null}],"form_code":"1604C","form_id":"1604c-v2018","form_revision":"2018-01-01","format":"bir-evidence-packet-v1","official_package_evidence_id":"sha256-de8ef0815509d65189e6794e1f8135a5ecf5f2800005d1fc5c87043efd96dbca","official_package_version":"7.9.6.0","packet_digest_sha256":"8f5f7753251615deacc5e4b19ea1294d1770b1c1e8b6615fb42a302a47ca221e","packet_id":"1604c-v2018-evidence-packet-v1","review":{"reviewed_at_utc":"2026-07-26T16:49:54Z","reviewed_by":"Codex independent packet review waves A B C","status":"reviewed"},"rule_set_id":"1604c-v2018-p7.9.6.0","rule_set_source_state":{"source_set_sha256":null,"status":"planned"},"source_map_sha256":"0b939c2414c44c0cedff75f60ad58957edc4402478663089885e551cf4acfbca","source_verification_sha256":"8db9f6811481ecc5ab97e8c96908e49ac0ed92f9ed29f160080ca43d91f8da6e","tracked_v1_source_set_sha256":"f00f3a385cd3590ffac859a11aa52087c84397b052d9f368f95bb0bf1e2f059e","upstream_evidence":[{"evidence_id":"sha256-de8ef0815509d65189e6794e1f8135a5ecf5f2800005d1fc5c87043efd96dbca","path":"upstream/sha256/de/de8ef0815509d65189e6794e1f8135a5ecf5f2800005d1fc5c87043efd96dbca","sha256":"de8ef0815509d65189e6794e1f8135a5ecf5f2800005d1fc5c87043efd96dbca","size_bytes":57506304}]}