{"attestations":[{"attested":true,"attested_at_utc":"2026-07-26T16:02:44Z","attested_by":"codex-validation-capture","kind":"derived-only","statement":"The request contains only derived identifiers, hashes, counts, locators, and explicit gaps."},{"attested":true,"attested_at_utc":"2026-07-26T16:02:44Z","attested_by":"codex-validation-capture","kind":"no-taxpayer-values","statement":"No real taxpayer values were used or copied during this capture."},{"attested":true,"attested_at_utc":"2026-07-26T16:02:44Z","attested_by":"codex-validation-capture","kind":"no-credentials","statement":"No credentials were used or copied during this capture."},{"attested":true,"attested_at_utc":"2026-07-26T16:02:44Z","attested_by":"codex-validation-capture","kind":"no-online-submission","statement":"No online submission path was used during this capture."}],"canonicalization":"bir-json-c14n-v1","capture_provenance":{"capture_tool_version":"bir-rules-codegen 0.1.0 @ 13c7ee93d46f9b2e70ee24e8d4a2a1acd76fd419","command_argv":["bir-rules-codegen","verify-evidence-vault-source-map","--source-map","../validation-rules-evidence-input/maps/validation-rules-source-map-v1.json"],"finished_at_utc":"2026-07-26T15:54:37Z","official_app_version":"7.9.6.0","operating_system":"windows","started_at_utc":"2026-07-26T15:53:49Z","tool_commit":"13c7ee93d46f9b2e70ee24e8d4a2a1acd76fd419","windows_version":"Microsoft Windows [Version 10.0.26200.8875]"},"created_at_utc":"2026-07-26T16:02:44Z","derived_evidence":[{"classification":"non-taxpayer-derived","kind":"gap-report","media_type":"application/json","observation":{"reason":"The reviewed capture ledger records explicit evidence gaps; see the value-free gap inventory.","status":"gap"},"path":"derived/gaps.json","review_status":"reviewed","sha256":"0321f4e6ea97c2ba09ef30064945166588848ddc981132651a1b4dc120707857","size_bytes":1578,"source_evidence_ids":["sha256-2626eab0f2681bd811d12ae6ed60e177d1961e4f462be5ed453d674f3418671b","sha256-2ccf624c87c8a951443630a0803e5f1f4bd7800bceb850ff14e8160f5f6b59fd","sha256-968ce5e240cfb1ad53ec831d5cd6a94493087bdeefaac88b0d536938cc784062","sha256-de8ef0815509d65189e6794e1f8135a5ecf5f2800005d1fc5c87043efd96dbca","sha256-e591320154a6eeb68f1f7d983d39e0c89b933cf413a1c4d4f01552ab982eae2f"],"source_excerpt":null},{"classification":"non-taxpayer-derived","kind":"record-census","media_type":"application/json","observation":{"status":"observed"},"path":"derived/tracked-v1-summary.json","review_status":"reviewed","sha256":"04558798ba75c5af251d4eaba01035b93f6c3a161a683e8478734f7df6ec80bc","size_bytes":153707,"source_evidence_ids":["sha256-2626eab0f2681bd811d12ae6ed60e177d1961e4f462be5ed453d674f3418671b","sha256-2ccf624c87c8a951443630a0803e5f1f4bd7800bceb850ff14e8160f5f6b59fd","sha256-968ce5e240cfb1ad53ec831d5cd6a94493087bdeefaac88b0d536938cc784062","sha256-de8ef0815509d65189e6794e1f8135a5ecf5f2800005d1fc5c87043efd96dbca","sha256-e591320154a6eeb68f1f7d983d39e0c89b933cf413a1c4d4f01552ab982eae2f"],"source_excerpt":null}],"form_code":"2200S","form_id":"2200s-v2018","form_revision":"2018-01-01","format":"bir-evidence-packet-v1","official_package_evidence_id":"sha256-de8ef0815509d65189e6794e1f8135a5ecf5f2800005d1fc5c87043efd96dbca","official_package_version":"7.9.6.0","packet_digest_sha256":"6fe7c108ef7149d5707eec9571dc6a8a500f0cb4e1ce9d59ac83b45b3bf2f927","packet_id":"2200s-v2018-evidence-packet-v1","review":{"reviewed_at_utc":"2026-07-26T16:49:54Z","reviewed_by":"Codex independent packet review waves A B C","status":"reviewed"},"rule_set_id":"2200s-v2018-p7.9.6.0","rule_set_source_state":{"source_set_sha256":null,"status":"planned"},"source_map_sha256":"0b939c2414c44c0cedff75f60ad58957edc4402478663089885e551cf4acfbca","source_verification_sha256":"8db9f6811481ecc5ab97e8c96908e49ac0ed92f9ed29f160080ca43d91f8da6e","tracked_v1_source_set_sha256":"6c8304575a8626109cd5b915868a396819b3e231bbd8d3eb84eac892e282398d","upstream_evidence":[{"evidence_id":"sha256-2626eab0f2681bd811d12ae6ed60e177d1961e4f462be5ed453d674f3418671b","path":"upstream/sha256/26/2626eab0f2681bd811d12ae6ed60e177d1961e4f462be5ed453d674f3418671b","sha256":"2626eab0f2681bd811d12ae6ed60e177d1961e4f462be5ed453d674f3418671b","size_bytes":754380},{"evidence_id":"sha256-2ccf624c87c8a951443630a0803e5f1f4bd7800bceb850ff14e8160f5f6b59fd","path":"upstream/sha256/2c/2ccf624c87c8a951443630a0803e5f1f4bd7800bceb850ff14e8160f5f6b59fd","sha256":"2ccf624c87c8a951443630a0803e5f1f4bd7800bceb850ff14e8160f5f6b59fd","size_bytes":595644},{"evidence_id":"sha256-968ce5e240cfb1ad53ec831d5cd6a94493087bdeefaac88b0d536938cc784062","path":"upstream/sha256/96/968ce5e240cfb1ad53ec831d5cd6a94493087bdeefaac88b0d536938cc784062","sha256":"968ce5e240cfb1ad53ec831d5cd6a94493087bdeefaac88b0d536938cc784062","size_bytes":244489},{"evidence_id":"sha256-de8ef0815509d65189e6794e1f8135a5ecf5f2800005d1fc5c87043efd96dbca","path":"upstream/sha256/de/de8ef0815509d65189e6794e1f8135a5ecf5f2800005d1fc5c87043efd96dbca","sha256":"de8ef0815509d65189e6794e1f8135a5ecf5f2800005d1fc5c87043efd96dbca","size_bytes":57506304},{"evidence_id":"sha256-e591320154a6eeb68f1f7d983d39e0c89b933cf413a1c4d4f01552ab982eae2f","path":"upstream/sha256/e5/e591320154a6eeb68f1f7d983d39e0c89b933cf413a1c4d4f01552ab982eae2f","sha256":"e591320154a6eeb68f1f7d983d39e0c89b933cf413a1c4d4f01552ab982eae2f","size_bytes":28914}]}