{"attestations":[{"attested":true,"attested_at_utc":"2026-07-26T16:02:44Z","attested_by":"codex-validation-capture","kind":"derived-only","statement":"The request contains only derived identifiers, hashes, counts, locators, and explicit gaps."},{"attested":true,"attested_at_utc":"2026-07-26T16:02:44Z","attested_by":"codex-validation-capture","kind":"no-taxpayer-values","statement":"No real taxpayer values were used or copied during this capture."},{"attested":true,"attested_at_utc":"2026-07-26T16:02:44Z","attested_by":"codex-validation-capture","kind":"no-credentials","statement":"No credentials were used or copied during this capture."},{"attested":true,"attested_at_utc":"2026-07-26T16:02:44Z","attested_by":"codex-validation-capture","kind":"no-online-submission","statement":"No online submission path was used during this capture."}],"canonicalization":"bir-json-c14n-v1","capture_provenance":{"capture_tool_version":"bir-rules-codegen 0.1.0 @ 13c7ee93d46f9b2e70ee24e8d4a2a1acd76fd419","command_argv":["bir-rules-codegen","verify-evidence-vault-source-map","--source-map","../validation-rules-evidence-input/maps/validation-rules-source-map-v1.json"],"finished_at_utc":"2026-07-26T15:54:37Z","official_app_version":"7.9.6.0","operating_system":"windows","started_at_utc":"2026-07-26T15:53:49Z","tool_commit":"13c7ee93d46f9b2e70ee24e8d4a2a1acd76fd419","windows_version":"Microsoft Windows [Version 10.0.26200.8875]"},"created_at_utc":"2026-07-26T16:02:44Z","derived_evidence":[{"classification":"non-taxpayer-derived","kind":"gap-report","media_type":"application/json","observation":{"reason":"The reviewed capture ledger records explicit evidence gaps; see the value-free gap inventory.","status":"gap"},"path":"derived/gaps.json","review_status":"reviewed","sha256":"0d25e41b601f998bb590087636b4961c5d4acb6b863087c784fd8297cd0622ff","size_bytes":2213,"source_evidence_ids":["sha256-06cbd878536d2960ef556fbfb29a23e9a58896f1ae4e43623a6f389c916f7e0a","sha256-21fc91fffadb99b78f9495cca3c25e8ba14e76a4467a181adbd73ef5607c68f5","sha256-c0f36cb2700668dd1cba093afe02f614bdb561e4bb01932f2d21bca1a0c9fcb9","sha256-c102cf9b62a73dbe491e6e181e33384668d5fd8152e49b4005ee4563f4cb908b","sha256-d19c4ebe40ed109094ef43687ed5486a003bd11a67a251bdd5545a41c2f46d8d","sha256-de8ef0815509d65189e6794e1f8135a5ecf5f2800005d1fc5c87043efd96dbca","sha256-ec49207aab9b035d1913d41091b677d9df690e01b391ed2c2f4c34cf43a524c6"],"source_excerpt":null},{"classification":"non-taxpayer-derived","kind":"record-census","media_type":"application/json","observation":{"status":"observed"},"path":"derived/tracked-v1-summary.json","review_status":"reviewed","sha256":"f067d00819e164b45e1fc2dabda248f8f987afb478c4ecf6a05f5412752e6957","size_bytes":192941,"source_evidence_ids":["sha256-06cbd878536d2960ef556fbfb29a23e9a58896f1ae4e43623a6f389c916f7e0a","sha256-21fc91fffadb99b78f9495cca3c25e8ba14e76a4467a181adbd73ef5607c68f5","sha256-c0f36cb2700668dd1cba093afe02f614bdb561e4bb01932f2d21bca1a0c9fcb9","sha256-c102cf9b62a73dbe491e6e181e33384668d5fd8152e49b4005ee4563f4cb908b","sha256-d19c4ebe40ed109094ef43687ed5486a003bd11a67a251bdd5545a41c2f46d8d","sha256-de8ef0815509d65189e6794e1f8135a5ecf5f2800005d1fc5c87043efd96dbca","sha256-ec49207aab9b035d1913d41091b677d9df690e01b391ed2c2f4c34cf43a524c6"],"source_excerpt":null}],"form_code":"1801","form_id":"1801-v2018","form_revision":"2018-01-01","format":"bir-evidence-packet-v1","official_package_evidence_id":"sha256-de8ef0815509d65189e6794e1f8135a5ecf5f2800005d1fc5c87043efd96dbca","official_package_version":"7.9.6.0","packet_digest_sha256":"3a08560168a6c3543cbbcbcb39ac9d1e129fb29d273895116d32525374d079de","packet_id":"1801-v2018-evidence-packet-v1","review":{"reviewed_at_utc":"2026-07-26T16:49:54Z","reviewed_by":"Codex independent packet review waves A B C","status":"reviewed"},"rule_set_id":"1801-v2018-p7.9.6.0","rule_set_source_state":{"source_set_sha256":null,"status":"planned"},"source_map_sha256":"0b939c2414c44c0cedff75f60ad58957edc4402478663089885e551cf4acfbca","source_verification_sha256":"8db9f6811481ecc5ab97e8c96908e49ac0ed92f9ed29f160080ca43d91f8da6e","tracked_v1_source_set_sha256":"b07e050d86608aea00a58a1c022ac01e57901d38e3cfa6e36dea3f0ec9a8c3bd","upstream_evidence":[{"evidence_id":"sha256-06cbd878536d2960ef556fbfb29a23e9a58896f1ae4e43623a6f389c916f7e0a","path":"upstream/sha256/06/06cbd878536d2960ef556fbfb29a23e9a58896f1ae4e43623a6f389c916f7e0a","sha256":"06cbd878536d2960ef556fbfb29a23e9a58896f1ae4e43623a6f389c916f7e0a","size_bytes":158264},{"evidence_id":"sha256-21fc91fffadb99b78f9495cca3c25e8ba14e76a4467a181adbd73ef5607c68f5","path":"upstream/sha256/21/21fc91fffadb99b78f9495cca3c25e8ba14e76a4467a181adbd73ef5607c68f5","sha256":"21fc91fffadb99b78f9495cca3c25e8ba14e76a4467a181adbd73ef5607c68f5","size_bytes":19913},{"evidence_id":"sha256-c0f36cb2700668dd1cba093afe02f614bdb561e4bb01932f2d21bca1a0c9fcb9","path":"upstream/sha256/c0/c0f36cb2700668dd1cba093afe02f614bdb561e4bb01932f2d21bca1a0c9fcb9","sha256":"c0f36cb2700668dd1cba093afe02f614bdb561e4bb01932f2d21bca1a0c9fcb9","size_bytes":21167},{"evidence_id":"sha256-c102cf9b62a73dbe491e6e181e33384668d5fd8152e49b4005ee4563f4cb908b","path":"upstream/sha256/c1/c102cf9b62a73dbe491e6e181e33384668d5fd8152e49b4005ee4563f4cb908b","sha256":"c102cf9b62a73dbe491e6e181e33384668d5fd8152e49b4005ee4563f4cb908b","size_bytes":313365},{"evidence_id":"sha256-d19c4ebe40ed109094ef43687ed5486a003bd11a67a251bdd5545a41c2f46d8d","path":"upstream/sha256/d1/d19c4ebe40ed109094ef43687ed5486a003bd11a67a251bdd5545a41c2f46d8d","sha256":"d19c4ebe40ed109094ef43687ed5486a003bd11a67a251bdd5545a41c2f46d8d","size_bytes":228576},{"evidence_id":"sha256-de8ef0815509d65189e6794e1f8135a5ecf5f2800005d1fc5c87043efd96dbca","path":"upstream/sha256/de/de8ef0815509d65189e6794e1f8135a5ecf5f2800005d1fc5c87043efd96dbca","sha256":"de8ef0815509d65189e6794e1f8135a5ecf5f2800005d1fc5c87043efd96dbca","size_bytes":57506304},{"evidence_id":"sha256-ec49207aab9b035d1913d41091b677d9df690e01b391ed2c2f4c34cf43a524c6","path":"upstream/sha256/ec/ec49207aab9b035d1913d41091b677d9df690e01b391ed2c2f4c34cf43a524c6","sha256":"ec49207aab9b035d1913d41091b677d9df690e01b391ed2c2f4c34cf43a524c6","size_bytes":812403}]}