{"attestations":[{"attested":true,"attested_at_utc":"2026-07-26T16:02:44Z","attested_by":"codex-validation-capture","kind":"derived-only","statement":"The request contains only derived identifiers, hashes, counts, locators, and explicit gaps."},{"attested":true,"attested_at_utc":"2026-07-26T16:02:44Z","attested_by":"codex-validation-capture","kind":"no-taxpayer-values","statement":"No real taxpayer values were used or copied during this capture."},{"attested":true,"attested_at_utc":"2026-07-26T16:02:44Z","attested_by":"codex-validation-capture","kind":"no-credentials","statement":"No credentials were used or copied during this capture."},{"attested":true,"attested_at_utc":"2026-07-26T16:02:44Z","attested_by":"codex-validation-capture","kind":"no-online-submission","statement":"No online submission path was used during this capture."}],"canonicalization":"bir-json-c14n-v1","capture_provenance":{"capture_tool_version":"bir-rules-codegen 0.1.0 @ 13c7ee93d46f9b2e70ee24e8d4a2a1acd76fd419","command_argv":["bir-rules-codegen","verify-evidence-vault-source-map","--source-map","../validation-rules-evidence-input/maps/validation-rules-source-map-v1.json"],"finished_at_utc":"2026-07-26T15:54:37Z","official_app_version":"7.9.6.0","operating_system":"windows","started_at_utc":"2026-07-26T15:53:49Z","tool_commit":"13c7ee93d46f9b2e70ee24e8d4a2a1acd76fd419","windows_version":"Microsoft Windows [Version 10.0.26200.8875]"},"created_at_utc":"2026-07-26T16:02:44Z","derived_evidence":[{"classification":"non-taxpayer-derived","kind":"gap-report","media_type":"application/json","observation":{"reason":"The reviewed capture ledger records explicit evidence gaps; see the value-free gap inventory.","status":"gap"},"path":"derived/gaps.json","review_status":"reviewed","sha256":"24c360f5e87017eaa061574636a3023851c9ab80d8c06457cad2fbeac4247645","size_bytes":2149,"source_evidence_ids":["sha256-263c9087feedc4d50e39544117026fa20378b25982bfb953e063c5f99c5c461e","sha256-5737ddbd86d467457b613cc1f016c51d1add7fa91b396f6af88d213bccc48202","sha256-7d0ceb5aad2c0eb90aeca189d6104ff05163ecd1820379f456125634ff7460f7","sha256-802912a60607bdd437faf429105e0efbcbd862894825b0682ded188c8a1aa38c","sha256-bc7f86f70bf993389a3a0135dcbd76c3e370c49d2eb95e2fc66ff318a2ebe43c","sha256-ca42592694e7416a15eca97fa25491c01da17e383038fc97dd9d6261e67bcf7d","sha256-de8ef0815509d65189e6794e1f8135a5ecf5f2800005d1fc5c87043efd96dbca"],"source_excerpt":null},{"classification":"non-taxpayer-derived","kind":"record-census","media_type":"application/json","observation":{"status":"observed"},"path":"derived/tracked-v1-summary.json","review_status":"reviewed","sha256":"dd760cd56831ff0d0e4cd5d1850012db00c87ec3125f4250105946dbc4bae4e8","size_bytes":276295,"source_evidence_ids":["sha256-263c9087feedc4d50e39544117026fa20378b25982bfb953e063c5f99c5c461e","sha256-5737ddbd86d467457b613cc1f016c51d1add7fa91b396f6af88d213bccc48202","sha256-7d0ceb5aad2c0eb90aeca189d6104ff05163ecd1820379f456125634ff7460f7","sha256-802912a60607bdd437faf429105e0efbcbd862894825b0682ded188c8a1aa38c","sha256-bc7f86f70bf993389a3a0135dcbd76c3e370c49d2eb95e2fc66ff318a2ebe43c","sha256-ca42592694e7416a15eca97fa25491c01da17e383038fc97dd9d6261e67bcf7d","sha256-de8ef0815509d65189e6794e1f8135a5ecf5f2800005d1fc5c87043efd96dbca"],"source_excerpt":null}],"form_code":"1701-MS","form_id":"1701ms-v2024","form_revision":"2024-08-01","format":"bir-evidence-packet-v1","official_package_evidence_id":"sha256-de8ef0815509d65189e6794e1f8135a5ecf5f2800005d1fc5c87043efd96dbca","official_package_version":"7.9.6.0","packet_digest_sha256":"eb514c2c84dfd78d9e3d150ed84d137c9b6c23505c24a3691480b18e7dea2037","packet_id":"1701ms-v2024-evidence-packet-v1","review":{"reviewed_at_utc":"2026-07-26T16:49:54Z","reviewed_by":"Codex independent packet review waves A B C","status":"reviewed"},"rule_set_id":"1701ms-v2024-p7.9.6.0","rule_set_source_state":{"source_set_sha256":null,"status":"planned"},"source_map_sha256":"0b939c2414c44c0cedff75f60ad58957edc4402478663089885e551cf4acfbca","source_verification_sha256":"8db9f6811481ecc5ab97e8c96908e49ac0ed92f9ed29f160080ca43d91f8da6e","tracked_v1_source_set_sha256":"a7490e4b0c96ac8ed9cb034e9cb0c62130cfe2981b18cf9ac9538bf985ca9e74","upstream_evidence":[{"evidence_id":"sha256-263c9087feedc4d50e39544117026fa20378b25982bfb953e063c5f99c5c461e","path":"upstream/sha256/26/263c9087feedc4d50e39544117026fa20378b25982bfb953e063c5f99c5c461e","sha256":"263c9087feedc4d50e39544117026fa20378b25982bfb953e063c5f99c5c461e","size_bytes":102380},{"evidence_id":"sha256-5737ddbd86d467457b613cc1f016c51d1add7fa91b396f6af88d213bccc48202","path":"upstream/sha256/57/5737ddbd86d467457b613cc1f016c51d1add7fa91b396f6af88d213bccc48202","sha256":"5737ddbd86d467457b613cc1f016c51d1add7fa91b396f6af88d213bccc48202","size_bytes":1061606},{"evidence_id":"sha256-7d0ceb5aad2c0eb90aeca189d6104ff05163ecd1820379f456125634ff7460f7","path":"upstream/sha256/7d/7d0ceb5aad2c0eb90aeca189d6104ff05163ecd1820379f456125634ff7460f7","sha256":"7d0ceb5aad2c0eb90aeca189d6104ff05163ecd1820379f456125634ff7460f7","size_bytes":7557},{"evidence_id":"sha256-802912a60607bdd437faf429105e0efbcbd862894825b0682ded188c8a1aa38c","path":"upstream/sha256/80/802912a60607bdd437faf429105e0efbcbd862894825b0682ded188c8a1aa38c","sha256":"802912a60607bdd437faf429105e0efbcbd862894825b0682ded188c8a1aa38c","size_bytes":585707},{"evidence_id":"sha256-bc7f86f70bf993389a3a0135dcbd76c3e370c49d2eb95e2fc66ff318a2ebe43c","path":"upstream/sha256/bc/bc7f86f70bf993389a3a0135dcbd76c3e370c49d2eb95e2fc66ff318a2ebe43c","sha256":"bc7f86f70bf993389a3a0135dcbd76c3e370c49d2eb95e2fc66ff318a2ebe43c","size_bytes":54582},{"evidence_id":"sha256-ca42592694e7416a15eca97fa25491c01da17e383038fc97dd9d6261e67bcf7d","path":"upstream/sha256/ca/ca42592694e7416a15eca97fa25491c01da17e383038fc97dd9d6261e67bcf7d","sha256":"ca42592694e7416a15eca97fa25491c01da17e383038fc97dd9d6261e67bcf7d","size_bytes":15980},{"evidence_id":"sha256-de8ef0815509d65189e6794e1f8135a5ecf5f2800005d1fc5c87043efd96dbca","path":"upstream/sha256/de/de8ef0815509d65189e6794e1f8135a5ecf5f2800005d1fc5c87043efd96dbca","sha256":"de8ef0815509d65189e6794e1f8135a5ecf5f2800005d1fc5c87043efd96dbca","size_bytes":57506304}]}