{"attestations":[{"attested":true,"attested_at_utc":"2026-07-26T16:02:44Z","attested_by":"codex-validation-capture","kind":"derived-only","statement":"The request contains only derived identifiers, hashes, counts, locators, and explicit gaps."},{"attested":true,"attested_at_utc":"2026-07-26T16:02:44Z","attested_by":"codex-validation-capture","kind":"no-taxpayer-values","statement":"No real taxpayer values were used or copied during this capture."},{"attested":true,"attested_at_utc":"2026-07-26T16:02:44Z","attested_by":"codex-validation-capture","kind":"no-credentials","statement":"No credentials were used or copied during this capture."},{"attested":true,"attested_at_utc":"2026-07-26T16:02:44Z","attested_by":"codex-validation-capture","kind":"no-online-submission","statement":"No online submission path was used during this capture."}],"canonicalization":"bir-json-c14n-v1","capture_provenance":{"capture_tool_version":"bir-rules-codegen 0.1.0 @ 13c7ee93d46f9b2e70ee24e8d4a2a1acd76fd419","command_argv":["bir-rules-codegen","verify-evidence-vault-source-map","--source-map","../validation-rules-evidence-input/maps/validation-rules-source-map-v1.json"],"finished_at_utc":"2026-07-26T15:54:37Z","official_app_version":"7.9.6.0","operating_system":"windows","started_at_utc":"2026-07-26T15:53:49Z","tool_commit":"13c7ee93d46f9b2e70ee24e8d4a2a1acd76fd419","windows_version":"Microsoft Windows [Version 10.0.26200.8875]"},"created_at_utc":"2026-07-26T16:02:44Z","derived_evidence":[{"classification":"non-taxpayer-derived","kind":"gap-report","media_type":"application/json","observation":{"reason":"The reviewed capture ledger records explicit evidence gaps; see the value-free gap inventory.","status":"gap"},"path":"derived/gaps.json","review_status":"reviewed","sha256":"1a22ef56e441b70b6c39d83dc51291d6fb3496f1b26af06e5b3a066244fab134","size_bytes":1142,"source_evidence_ids":["sha256-16e4db6ce456a6fb0a97f085cf8ef19349c2f6fc183971e97d4e253f63cdd22b","sha256-1f270ecf66d778836a14697863e420ff65d5ed0a5576a6cf58b97c9a8e8c9b24","sha256-8e5010d9b103076aa571612ed31f69b3a61c05d1af786c6256ac76b502f7d470","sha256-dc5c19710400e9bd15ceccd1bbeafc5290074b17b2d460af5f8921c6a7f93186","sha256-de8ef0815509d65189e6794e1f8135a5ecf5f2800005d1fc5c87043efd96dbca"],"source_excerpt":null},{"classification":"non-taxpayer-derived","kind":"record-census","media_type":"application/json","observation":{"status":"observed"},"path":"derived/tracked-v1-summary.json","review_status":"reviewed","sha256":"fd99706a3f358820b48c2e7f75ada6806dca2742619927544d94f5a0a6bb4bce","size_bytes":128604,"source_evidence_ids":["sha256-16e4db6ce456a6fb0a97f085cf8ef19349c2f6fc183971e97d4e253f63cdd22b","sha256-1f270ecf66d778836a14697863e420ff65d5ed0a5576a6cf58b97c9a8e8c9b24","sha256-8e5010d9b103076aa571612ed31f69b3a61c05d1af786c6256ac76b502f7d470","sha256-dc5c19710400e9bd15ceccd1bbeafc5290074b17b2d460af5f8921c6a7f93186","sha256-de8ef0815509d65189e6794e1f8135a5ecf5f2800005d1fc5c87043efd96dbca"],"source_excerpt":null}],"form_code":"2551Q","form_id":"2551q-v2018","form_revision":"2018-01-01","format":"bir-evidence-packet-v1","official_package_evidence_id":"sha256-de8ef0815509d65189e6794e1f8135a5ecf5f2800005d1fc5c87043efd96dbca","official_package_version":"7.9.6.0","packet_digest_sha256":"5f347bc445c55906a04b06c58ad8c472ded1bfcc406ce9a383c78562466e806b","packet_id":"2551q-v2018-evidence-packet-v1","review":{"reviewed_at_utc":"2026-07-26T16:49:54Z","reviewed_by":"Codex independent packet review waves A B C","status":"reviewed"},"rule_set_id":"2551q-v2018-p7.9.6.0","rule_set_source_state":{"source_set_sha256":null,"status":"planned"},"source_map_sha256":"0b939c2414c44c0cedff75f60ad58957edc4402478663089885e551cf4acfbca","source_verification_sha256":"8db9f6811481ecc5ab97e8c96908e49ac0ed92f9ed29f160080ca43d91f8da6e","tracked_v1_source_set_sha256":"9d8da80062f5b87d82a3a211c6256d6166b0b62162266f53abfce667e87122e3","upstream_evidence":[{"evidence_id":"sha256-16e4db6ce456a6fb0a97f085cf8ef19349c2f6fc183971e97d4e253f63cdd22b","path":"upstream/sha256/16/16e4db6ce456a6fb0a97f085cf8ef19349c2f6fc183971e97d4e253f63cdd22b","sha256":"16e4db6ce456a6fb0a97f085cf8ef19349c2f6fc183971e97d4e253f63cdd22b","size_bytes":153753},{"evidence_id":"sha256-1f270ecf66d778836a14697863e420ff65d5ed0a5576a6cf58b97c9a8e8c9b24","path":"upstream/sha256/1f/1f270ecf66d778836a14697863e420ff65d5ed0a5576a6cf58b97c9a8e8c9b24","sha256":"1f270ecf66d778836a14697863e420ff65d5ed0a5576a6cf58b97c9a8e8c9b24","size_bytes":564749},{"evidence_id":"sha256-8e5010d9b103076aa571612ed31f69b3a61c05d1af786c6256ac76b502f7d470","path":"upstream/sha256/8e/8e5010d9b103076aa571612ed31f69b3a61c05d1af786c6256ac76b502f7d470","sha256":"8e5010d9b103076aa571612ed31f69b3a61c05d1af786c6256ac76b502f7d470","size_bytes":20100},{"evidence_id":"sha256-dc5c19710400e9bd15ceccd1bbeafc5290074b17b2d460af5f8921c6a7f93186","path":"upstream/sha256/dc/dc5c19710400e9bd15ceccd1bbeafc5290074b17b2d460af5f8921c6a7f93186","sha256":"dc5c19710400e9bd15ceccd1bbeafc5290074b17b2d460af5f8921c6a7f93186","size_bytes":230243},{"evidence_id":"sha256-de8ef0815509d65189e6794e1f8135a5ecf5f2800005d1fc5c87043efd96dbca","path":"upstream/sha256/de/de8ef0815509d65189e6794e1f8135a5ecf5f2800005d1fc5c87043efd96dbca","sha256":"de8ef0815509d65189e6794e1f8135a5ecf5f2800005d1fc5c87043efd96dbca","size_bytes":57506304}]}