{"attestations":[{"attested":true,"attested_at_utc":"2026-07-26T16:02:44Z","attested_by":"codex-validation-capture","kind":"derived-only","statement":"The request contains only derived identifiers, hashes, counts, locators, and explicit gaps."},{"attested":true,"attested_at_utc":"2026-07-26T16:02:44Z","attested_by":"codex-validation-capture","kind":"no-taxpayer-values","statement":"No real taxpayer values were used or copied during this capture."},{"attested":true,"attested_at_utc":"2026-07-26T16:02:44Z","attested_by":"codex-validation-capture","kind":"no-credentials","statement":"No credentials were used or copied during this capture."},{"attested":true,"attested_at_utc":"2026-07-26T16:02:44Z","attested_by":"codex-validation-capture","kind":"no-online-submission","statement":"No online submission path was used during this capture."}],"canonicalization":"bir-json-c14n-v1","capture_provenance":{"capture_tool_version":"bir-rules-codegen 0.1.0 @ 13c7ee93d46f9b2e70ee24e8d4a2a1acd76fd419","command_argv":["bir-rules-codegen","verify-evidence-vault-source-map","--source-map","../validation-rules-evidence-input/maps/validation-rules-source-map-v1.json"],"finished_at_utc":"2026-07-26T15:54:37Z","official_app_version":"7.9.6.0","operating_system":"windows","started_at_utc":"2026-07-26T15:53:49Z","tool_commit":"13c7ee93d46f9b2e70ee24e8d4a2a1acd76fd419","windows_version":"Microsoft Windows [Version 10.0.26200.8875]"},"created_at_utc":"2026-07-26T16:02:44Z","derived_evidence":[{"classification":"non-taxpayer-derived","kind":"gap-report","media_type":"application/json","observation":{"reason":"The reviewed capture ledger records explicit evidence gaps; see the value-free gap inventory.","status":"gap"},"path":"derived/gaps.json","review_status":"reviewed","sha256":"33ea33a7063d0ff4999f00ab13bbef10d2f6f9e8607fbb8be36d5e76ddb71949","size_bytes":2138,"source_evidence_ids":["sha256-0b69656574f35c1b13c0cca56fc59670ace3525453ae3d765c2a0991197a81ed","sha256-1ef140b7d7584043163c6d37020dc34266ebbd293cff6f9adb341263cb70f9ea","sha256-58b1ff5157f6d66f1ed1252c696d13ab9afe090bae0c1793faf42ef104159d37","sha256-b8fa70696bea4a50aae94b9009b4281121112e9928b49eb156f8953949ae7cb8","sha256-de8ef0815509d65189e6794e1f8135a5ecf5f2800005d1fc5c87043efd96dbca","sha256-e2e837852680196d0e9aa9a513f55c7a6e4924493b5440548e46217166cc085e"],"source_excerpt":null},{"classification":"non-taxpayer-derived","kind":"record-census","media_type":"application/json","observation":{"status":"observed"},"path":"derived/tracked-v1-summary.json","review_status":"reviewed","sha256":"51e2457c11577c9712b7a50f2b148f80848dfcbe05a6a40ae5765ba60184cd21","size_bytes":196188,"source_evidence_ids":["sha256-0b69656574f35c1b13c0cca56fc59670ace3525453ae3d765c2a0991197a81ed","sha256-1ef140b7d7584043163c6d37020dc34266ebbd293cff6f9adb341263cb70f9ea","sha256-58b1ff5157f6d66f1ed1252c696d13ab9afe090bae0c1793faf42ef104159d37","sha256-b8fa70696bea4a50aae94b9009b4281121112e9928b49eb156f8953949ae7cb8","sha256-de8ef0815509d65189e6794e1f8135a5ecf5f2800005d1fc5c87043efd96dbca","sha256-e2e837852680196d0e9aa9a513f55c7a6e4924493b5440548e46217166cc085e"],"source_excerpt":null}],"form_code":"1800","form_id":"1800-v2018","form_revision":"2018-01-01","format":"bir-evidence-packet-v1","official_package_evidence_id":"sha256-de8ef0815509d65189e6794e1f8135a5ecf5f2800005d1fc5c87043efd96dbca","official_package_version":"7.9.6.0","packet_digest_sha256":"8845422213fd75c423a01caec0b5ed01247b0696794e444d43f14ea417afe9ab","packet_id":"1800-v2018-evidence-packet-v1","review":{"reviewed_at_utc":"2026-07-26T16:49:54Z","reviewed_by":"Codex independent packet review waves A B C","status":"reviewed"},"rule_set_id":"1800-v2018-p7.9.6.0","rule_set_source_state":{"source_set_sha256":null,"status":"planned"},"source_map_sha256":"0b939c2414c44c0cedff75f60ad58957edc4402478663089885e551cf4acfbca","source_verification_sha256":"8db9f6811481ecc5ab97e8c96908e49ac0ed92f9ed29f160080ca43d91f8da6e","tracked_v1_source_set_sha256":"d0762bdc125d2c135765572148797d84686eca10d5773ffaa14c233fbbe37f60","upstream_evidence":[{"evidence_id":"sha256-0b69656574f35c1b13c0cca56fc59670ace3525453ae3d765c2a0991197a81ed","path":"upstream/sha256/0b/0b69656574f35c1b13c0cca56fc59670ace3525453ae3d765c2a0991197a81ed","sha256":"0b69656574f35c1b13c0cca56fc59670ace3525453ae3d765c2a0991197a81ed","size_bytes":257866},{"evidence_id":"sha256-1ef140b7d7584043163c6d37020dc34266ebbd293cff6f9adb341263cb70f9ea","path":"upstream/sha256/1e/1ef140b7d7584043163c6d37020dc34266ebbd293cff6f9adb341263cb70f9ea","sha256":"1ef140b7d7584043163c6d37020dc34266ebbd293cff6f9adb341263cb70f9ea","size_bytes":15835},{"evidence_id":"sha256-58b1ff5157f6d66f1ed1252c696d13ab9afe090bae0c1793faf42ef104159d37","path":"upstream/sha256/58/58b1ff5157f6d66f1ed1252c696d13ab9afe090bae0c1793faf42ef104159d37","sha256":"58b1ff5157f6d66f1ed1252c696d13ab9afe090bae0c1793faf42ef104159d37","size_bytes":388254},{"evidence_id":"sha256-b8fa70696bea4a50aae94b9009b4281121112e9928b49eb156f8953949ae7cb8","path":"upstream/sha256/b8/b8fa70696bea4a50aae94b9009b4281121112e9928b49eb156f8953949ae7cb8","sha256":"b8fa70696bea4a50aae94b9009b4281121112e9928b49eb156f8953949ae7cb8","size_bytes":261044},{"evidence_id":"sha256-de8ef0815509d65189e6794e1f8135a5ecf5f2800005d1fc5c87043efd96dbca","path":"upstream/sha256/de/de8ef0815509d65189e6794e1f8135a5ecf5f2800005d1fc5c87043efd96dbca","sha256":"de8ef0815509d65189e6794e1f8135a5ecf5f2800005d1fc5c87043efd96dbca","size_bytes":57506304},{"evidence_id":"sha256-e2e837852680196d0e9aa9a513f55c7a6e4924493b5440548e46217166cc085e","path":"upstream/sha256/e2/e2e837852680196d0e9aa9a513f55c7a6e4924493b5440548e46217166cc085e","sha256":"e2e837852680196d0e9aa9a513f55c7a6e4924493b5440548e46217166cc085e","size_bytes":825577}]}